{
  "schemaVersion": "dauva.dev/pod/v1",
  "id": "factory",
  "status": "candidate",
  "metadata": {
    "title": {
      "en": "Factory",
      "nl": "Factory",
      "de": "Fabrik"
    },
    "description": {
      "en": "Persistent automation and factory Servers with durable saves and administration ports.",
      "nl": "Blijvende automatiserings- en factory-Servers met duurzame saves en beheerpoorten.",
      "de": "Persistente Automatisierungs- und Fabrik-Server mit dauerhaften Spielständen und Verwaltungsports."
    },
    "icon": "settings"
  }
}
